{
  "schemaVersion": 1,
  "artifactType": "search-console-report",
  "generatedAt": "2026-09-17T10:05:00Z",
  "reportId": "search-console-report-20260917T100500Z-example123456",
  "reportSha256": "7a16f85f3e81f9773c399867b289b224d253412b380687da41df57602337dc79",
  "profileId": "profile-0123456789abcdef",
  "site": "sc-domain:example.com",
  "propertyIdentity": {"siteUrl": "sc-domain:example.com", "propertyType": "domain"},
  "timezone": "America/Los_Angeles",
  "status": "ready",
  "qualityTier": "reliable_for_description",
  "periods": [{"label": "current", "from": "2026-08-17", "to": "2026-09-13", "complete": true, "dataState": "final"}],
  "datasets": [],
  "queries": [],
  "budget": {"maxRequests": 20, "maxRows": 12000, "requestsUsed": 0, "rowsUsed": 0},
  "facts": [],
  "calculations": [],
  "interpretations": [],
  "limitations": [],
  "recommendations": [],
  "questions": [],
  "mutationPerformed": false
}
